slug,bestPosition,impressions,topKeyword,topVolume
dyson-vs-shark-vacuum,66,51,"shark or dyson",5400
usa-vs-china,47,40,"is china bigger than the united states",6600
charles-schwab-vs-fidelity,59,40,"charles schwab vs fidelity",9900
ally-bank-vs-marcus-by-goldman-sachs,23,34,"marcus hysa",6600
firefox-vs-safari,40,26,"firefox v safari",720
toyota-rav4-vs-honda-cr-v,66,22,"honda crv vs toyota rav",5400
us-military-vs-china-military,22,19,"china military vs united states",880
phd-vs-masters-degree,51,14,"masters degree vs phd",3600
chase-vs-bank-of-america,53,14,"chase bank or bank of america",3600
mcafee-vs-norton,70,14,"mcafee versus norton antivirus",3600
youtube-tv-vs-hulu-live,46,13,"hulu live tv vs youtube tv",6600
schwab-vs-vanguard,32,11,"charles schwab vs vanguard",1900
ww1-vs-ww2,16,9,"compare ww1 and ww2",260
ipad-vs-samsung-tablet,51,6,"ipad versus samsung tablet",2900
mba-vs-masters,74,6,"m.a vs mba",1300
square-vs-stripe,85,6,"square up vs stripe",2900
bubly-vs-lacroix,24,4,"bubly vs la croix",210
cancun-vs-hawaii,44,4,"cancun vs hawaii",320
lebron-vs-jordan,24,3,"is lebron or jordan better",210
disney-plus-vs-paramount-plus,25,3,"disney and paramount",140
us-economy-vs-china-economy,30,3,"united states economy vs china",880
tidal-vs-spotify,33,3,"spotify sound quality vs tidal",140
macbook-air-m3-vs-macbook-air-m4,36,3,"m4 vs m3 macbook air",140
the-new-york-times-vs-washington-post,37,3,"nyt vs washington post",210
geico-vs-usaa,42,3,"is geico cheaper than usaa",210
google-flights-vs-kayak,42,3,"google flights vs kayak",140
quickbooks-vs-wave,60,3,"wave accounting vs quickbooks",1300
ikea-vs-wayfair,13,2,"wayfair quality vs ikea",110
expedia-vs-kayak,16,2,"expedia vs kayak",260
amazon-vs-best-buy,18,2,"amazon vs best buy",110
farmers-insurance-vs-state-farm,19,2,"is farmers insurance the same as state farm",260
macbook-air-vs-macbook-pro-difference-2026-specs,19,2,"macbook pro vs air 2026",110
ps5-pro-vs-xbox-series-x-performance-comparison-2026,20,2,"xbox series x vs ps5 pro specs",140
hulu-vs-peacock,21,2,"peacock hulu",170
amazon-vs-wayfair,23,2,"amazon and wayfair",210
tcl-vs-vizio,32,2,"which is better vizio or tcl",170
nintendo-switch-vs-playstation-5,32,2,"nintendo switch versus playstation 5",110
economy-class-vs-business-class,38,2,"difference between economy and business",140
american-express-vs-mastercard,42,2,"american express vs mastercard",210
crossfit-vs-gym,47,2,"crossfit vs gym",140
mercedes-vs-audi,58,2,"audi and mercedes",260
capital-one-vs-chase,13,1,"is chase or capital one better",140
jbl-vs-marshall,21,1,"marshall vs jbl",110
entertainment-style-netflix-shines-with-a-wide-variety-vs-youtube-tv-comparison-2026,22,1,"netflix vs youtube tv",170
hbo-max-vs-netflix,27,1,"hbo vs netflix",210
cloudflare-vs-porkbun,30,1,"cloudflare vs porkbun",210
iphone-vs-samsung-galaxy,33,1,"new iphone versus new samsung",170
audible-vs-libby,33,1,"libby vs audible",140
neymar-vs-mbappe,36,1,"who is better neymar or mbappe",170
backblaze-vs-carbonite,37,1,"backblaze vs carbonite",140
neymar-vs-mbape,37,1,"neymar vs mbappe",110
airpods-4-vs-airpods-pro,40,1,"apple airpods 4 vs pro",170
north-korea-vs-south-korea,40,1,"compare north and south korea",110
jimmy-john-s-vs-subway,40,1,"jimmy john's subways",110
chipotle-vs-taco-bell,42,1,"chipotle or taco bell",170
eufy-robovac-vs-irobot-roomba,42,1,"eufy vs irobot",140
xbox-series-x-vs-nintendo-switch-2,42,1,"nintendo switch 2 vs xbox series x",110
bose-vs-sonos,43,1,"bose or sonos",210
hbo-max-vs-hulu,44,1,"hulu vs hbo max",210
mac-vs-windows,45,1,"why macs are better than windows",260
mercedes-vs-tesla,46,1,"mercedes vs tesla",170
amazon-vs-chewy,47,1,"chewy vs amazon",210
apple-music-vs-spotify,49,1,"apple music vs spotify 2025",170
google-pixel-vs-samsung-galaxy,58,1,"samsung vs pixel",480
xero-vs-freshbooks,81,1,"freshbooks vs xero",320
khan-academy-vs-brilliant,23,0,"brilliant vs khan academy",90
real-madrid-vs-barcelona,25,0,"real madrid and barcelona trophies",170
kindle-vs-physical-books,25,0,"kindle or physical book",90
macbook-air-vs-macbook-pro-weight-comparison-2025-2026,25,0,"weight difference between macbook pro and air",40
taskrabbit-vs-thumbtack,27,0,"thumbtack or taskrabbit",90
marshalls-vs-tj-maxx,27,0,"is tj maxx better than marshalls",70
zoom-vs-google-meet,28,0,"google meet pricing vs zoom",50
bose-vs-jbl,29,0,"bose vs jbl car speakers",90
kobe-bryant-vs-lebron-james,31,0,"kobe bryant vs lebron",70
vanguard-vs-fidelity,32,0,"fidelity vs",170
dji-osmo-action-4-vs-gopro-hero-13,32,0,"dji action 4 vs gopro 13",50
litter-robot-vs-petsafe-scoopfree,33,0,"litter-robot vs petsafe",50
realtor-com-vs-zillow,34,0,"realtor com vs zillow",140
paramount-plus-vs-peacock,35,0,"difference between peacock and paramount plus",70
google-pixel-vs-iphone,37,0,"google phone vs apple iphone",170
playstation-plus-vs-xbox-game-pass,37,0,"xbox game pass vs playstation plus",140
macbook-pro-14-vs-16,38,0,"16 vs 14 macbook pro",70
amazon-echo-vs-google-nest-hub,38,0,"google home hub vs echo show 8",50
tiger-woods-vs-jack-nicklaus,39,0,"tiger vs jack stats",70
apple-tv-4k-vs-roku-ultra,39,0,"roku ultra or apple tv",50
xbox-series-x-vs-steam-deck,40,0,"xbox series x vs steam deck",40
b-2-vs-b-52,41,0,"b-52 bomber vs b2",70
xbox-series-x-vs-ps5-performance-comparison-latest-2026,41,0,"xbox series x vs ps5 pro performance",50
messi-vs-ronaldo,43,0,"messi vs ronaldo 2024",90
t-mobile-vs-verizon,43,0,"t mobile and verizon coverage comparison",90
dell-xps-13-vs-macbook-air,44,0,"macbook air vs dell xps 13",140
macbook-air-vs-macbook-pro-differences-2026,44,0,"macbook air vs macbook pro 2026",70
nest-doorbell-vs-ring-video-doorbell,45,0,"ring or nest doorbell",110
peacock-vs-hulu,45,0,"is peacock included with hulu",90
netflix-vs-max,46,0,"netflix max users",170
macbook-air-vs-macbook-pro,46,0,"difference between macbook air and pro 2025",110
ford-vs-toyota,46,0,"is ford better than toyota",90
india-military-vs-pakistan-military,47,0,"india vs pakistan military comparison",70
japan-vs-china,49,0,"is china bigger than japan",70
casper-vs-tuft-needle,50,0,"casper mattress vs tuft and needle",50
rover-vs-wag,50,0,"wag cost",50
burger-king-vs-mcdonald-s,51,0,"mcdonald's vs burger king statistics",50
texas-vs-california-economy-comparison-2026,52,0,"california gdp vs texas",110
airpods-pro-2-vs-sony-wh-1000xm5,52,0,"sony xm5 vs airpods pro 2",50
dyson-airwrap-vs-shark-flexstyle,52,0,"dyson air wrap shark",40
dunkin-vs-starbucks,52,0,"is starbucks or dunkin more popular",40
american-airlines-vs-united-airlines,53,0,"american or united better",90
ring-vs-simplisafe,53,0,"simplisafe and ring",50
korean-war-vs-vietnam-war-comparison,55,0,"differences between korean and vietnam war",170
chipotle-vs-qdoba,55,0,"is qdoba or chipotle cheaper",170
bank-of-america-vs-chase,56,0,"bank of america vs chase checking account",70
serena-vs-venus,56,0,"venus vs serena head-to-head",50
pandora-vs-spotify,57,0,"pandora vs spotify price",210
zoom-vs-microsoft-teams,57,0,"zoom vs ms teams",140
bmw-vs-mercedes,57,0,"difference between bmw and mercedes",90
genesis-vs-mercedes-benz,57,0,"mercedes vs genesis",50
southwest-airlines-vs-delta-airlines,58,0,"is delta or southwest better",170
roomba-vs-roborock,58,0,"is roborock better than roomba",170
1password-vs-bitwarden,58,0,"1password or bitwarden",70
netflix-vs-disney,58,0,"netflix vs disney net worth",30
irobot-roomba-vs-shark-iq,59,0,"irobot vs shark",170
netflix-vs-hulu,59,0,"netflix vs hulu price",170
geico-vs-state-farm,59,0,"state farm vs geico auto insurance",140
asics-vs-new-balance,59,0,"asics vs new balance running shoes",90
godaddy-vs-squarespace,59,0,"godaddy vs squarespace domain",70
cuisinart-vs-kitchenaid,59,0,"kitchenaid and cuisinart",70
chatgpt-vs-copilot,60,0,"copilot vs gpt",110
mba-vs-masters-degree,60,0,"ma vs mba salary",40
netflix-vs-peacock-comparison-2026,60,0,"which is better netflix or peacock",40
kfc-vs-popeyes,61,0,"is popeyes cheaper than kfc",50
crocs-vs-ugg,61,0,"ugg and crocs",50
ring-doorbell-vs-nest-doorbell,62,0,"ring doorbell vs google doorbell",90
carnival-vs-royal-caribbean,62,0,"compare carnival and royal caribbean",70
coinbase-vs-crypto-com,62,0,"crypto.com or coinbase",50
allstate-vs-geico,63,0,"allstate or geico",90
bmw-ix-vs-tesla-model-y,63,0,"tesla model y vs bmw ix",70
subaru-outback-vs-toyota-rav4,64,0,"subaru outback vs toyota rav4 specs",110
monster-energy-vs-red-bull,64,0,"red bull vs monster sales",50
coleman-vs-yeti,65,0,"coleman vs yeti",110
paramount-plus-vs-hulu,65,0,"paramount plus versus hulu",90
tsa-precheck-vs-global-entry,66,0,"does global entry replace tsa precheck",70
polestar-2-vs-tesla-model-3,66,0,"polestar 2 versus model 3",70
disney-plus-vs-hulu,66,0,"hulu vs disney plus cost",40
honda-cr-v-vs-mazda-cx-5,67,0,"2026 cr v cx 5 comparison",90
ps5-vs-xbox-series-x,67,0,"ps5 specs vs xbox series x",90
oura-ring-vs-whoop,67,0,"whoop bracelet vs oura ring",50
booking-com-vs-expedia,68,0,"is expedia or booking.com better for hotels",50
venmo-vs-zelle,69,0,"which is more popular zelle or venmo",70
checking-account-vs-savings-account,69,0,"bank of america checking vs savings account",50
toyota-vs-honda,70,0,"compare honda and toyota",110
cash-app-vs-zelle,71,0,"is zelle the same as cash app",210
costco-vs-sam-s-club,71,0,"sam's club vs costco membership cost",170
hilton-vs-marriott,73,0,"is marriott and hilton the same",170
homeschool-vs-public-school,73,0,"price of homeschooling vs public schooling",50
public-school-vs-private-school,74,0,"private high schools vs public high schools",140
cash-app-vs-venmo,74,0,"what's the difference between cash app and venmo",90
squarespace-vs-wix,75,0,"wix pricing vs squarespace",90
stanley-vs-yeti,75,0,"stanley v yeti",50
clickup-vs-monday,76,0,"clickup versus monday com",170
hubspot-vs-pipedrive,78,0,"pipedrive hubspot",30
google-drive-vs-onedrive,79,0,"google drive vs microsoft onedrive",170
kroger-vs-safeway,79,0,"are kroger and safeway the same",50
notion-vs-clickup,79,0,"notion clickup",30
paypal-vs-venmo,84,0,"what is the difference between paypal and venmo",110
bmw-vs-mercedes-benz,84,0,"compare bmw mercedes",50
keurig-vs-nespresso,88,0,"how is nespresso different from keurig",70
nordvpn-vs-surfshark,88,0,"which is better nordvpn or surfshark",40
crossfit-vs-gym-training,89,0,"is cross training the same as crossfit",40
google-meet-vs-zoom,94,0,"zoom vs google meet price",40
ford-f-150-vs-chevrolet-silverado,95,0,"ford f 150 compared to chevy silverado",50